{
  "$schema": "http://json-schema.org/draft-07/schema#",
  "$id": "https://immediately.run/viewer-manifest.schema.json",
  "title": "immediately.run viewer component manifest",
  "description": "The component vocabulary a directory-as-content VIEWER declares. Two-way surface (PLATFORM_LAYERING_SPEC §5 target 3): a corpus checker reads it to know which components a corpus may use, and a thin shell composing the viewer as a library (§1.1 M3) reads it to know which components it may override, with what props. The FORMAT is viewer-generic — a Lodestar manifest with a node/edge vocabulary validates through this same schema; only the entries are per-viewer.",
  "type": "object",
  "required": ["schemaVersion", "viewer", "components"],
  "additionalProperties": false,
  "properties": {
    "$schema": { "type": "string" },
    "schemaVersion": { "const": 1 },
    "viewer": {
      "type": "object",
      "required": ["name"],
      "additionalProperties": false,
      "properties": {
        "name": { "type": "string", "description": "The package name a shell imports." },
        "kind": { "type": "string", "description": "The content kind this viewer renders (`wiki`, `board`, …) — display and discovery only; it confers nothing." },
        "task": { "type": "string", "description": "The task CONTRACT this viewer provides, matching package.json `immediately.run.provides`." }
      }
    },
    "components": {
      "type": "object",
      "description": "Component name → its contract. A name absent here is INTERNAL: a corpus using it is flagged, and a shell overriding it fails visibly.",
      "additionalProperties": {
        "type": "object",
        "required": ["tier", "overridable"],
        "additionalProperties": false,
        "properties": {
          "tier": {
            "enum": ["engine", "chrome", "corpus"],
            "description": "`engine` renders any corpus and holds no opinion about its subject; `chrome` is site furniture a layout arranges; `corpus` is furniture encoding ONE corpus's frontmatter conventions, declared by that corpus rather than the engine (ENGINE_BOUNDARY §3)."
          },
          "overridable": {
            "type": "boolean",
            "description": "Whether a library-composing shell may replace it. False for components whose behaviour is engine mechanics rather than presentation."
          },
          "sanitizing": {
            "type": "boolean",
            "description": "Whether this component is a sanitizing wrapper on the interpreter path. An override of a sanitizing component inherits the obligation — that is why the flag is on the contract and not in a comment."
          },
          "props": {
            "type": "object",
            "description": "Prop name → a short type string (`string?`, `number?`, `node?`, `string[]?`). Documentation for an overriding shell, not a runtime check.",
            "additionalProperties": { "type": "string" }
          },
          "summary": { "type": "string" }
        }
      }
    },
    "frontmatter": {
      "type": "object",
      "description": "Frontmatter key OWNERSHIP (PLATFORM_LAYERING §5 target 1). Each side validates the keys it owns; pass-through is what keeps a foreign corpus with its own vocabulary renderable.",
      "additionalProperties": false,
      "properties": {
        "engine": { "type": "array", "items": { "type": "string" }, "description": "Keys the ENGINE reads. Changing one changes rendering." },
        "corpusTooling": { "type": "array", "items": { "type": "string" }, "description": "Keys a corpus's own tooling reads. The engine ignores them." },
        "passThrough": { "type": "boolean", "description": "Whether unknown keys are allowed (they are carried, unread). False makes the vocabulary closed." }
      }
    },
    "themes": {
      "type": "object",
      "description": "The theme catalogue (R3-310, bucket-independent): every shipped look, keyed by its `theme:` id. The gallery enumerates THIS, so adding a theme adds a row with no edit to any entry.",
      "additionalProperties": {
        "type": "object",
        "required": ["label", "preferred", "ships", "summary"],
        "additionalProperties": false,
        "properties": {
          "label": { "type": "string", "description": "The reader-facing name in the theme menu." },
          "preferred": { "enum": ["light", "dark"], "description": "The polarity the theme opens in when the reader and host have both said nothing." },
          "ships": { "type": "boolean", "description": "Whether the theme is selectable today." },
          "summary": { "type": "string" }
        }
      }
    },
    "pageVariants": {
      "type": "object",
      "description": "The page-variant catalogue (R3-309, bucket B): a frontmatter key on one entry — the page, not the chrome. Behaviour lives in CSS selected by the emitted data attribute; an undeclared value falls back rather than rendering unstyled.",
      "additionalProperties": {
        "type": "object",
        "required": ["key", "value", "ships", "summary"],
        "additionalProperties": false,
        "properties": {
          "key": { "type": "string", "description": "The frontmatter key (`layout`, `frame`)." },
          "value": { "type": "string", "description": "The value that selects this variant." },
          "ships": { "type": "boolean", "description": "Whether the variant has shipped CSS today." },
          "summary": { "type": "string" }
        }
      }
    },
    "layouts": {
      "type": "object",
      "description": "The layout-starters catalogue (R3-309, bucket A): `_layout.mdx` starters under `content/_layouts/` a contributor or agent copies from. Keyed by starter id (= filename); `layoutRole` is the declared kind the entry and the file must agree on — the field existed in the sample layouts for a year with nothing reading it, and the catalogue is what gives it a job.",
      "additionalProperties": {
        "type": "object",
        "required": ["layoutRole", "arranges", "ships", "summary"],
        "additionalProperties": false,
        "properties": {
          "layoutRole": {
            "enum": ["root", "section"],
            "description": "`root` is an outermost shell (selects the nav arrangement); `section` nests under a root and wraps one folder."
          },
          "arranges": { "type": "string", "description": "The chrome the starter arranges around `<Outlet/>`." },
          "ships": { "type": "boolean", "description": "Whether the starter file exists today (kept false for a catalogue entry whose file lands with a later item)." },
          "summary": { "type": "string" }
        }
      }
    },
    "collections": {
      "type": "object",
      "description": "The collection-shapes catalogue (R3-309, bucket C): what a LIST of entries looks like. Behaviour lives here, not in a starter — an `_layout.mdx` cannot hold state, so infinite scroll is an engine component's literal prop, never a file you copy.",
      "additionalProperties": {
        "type": "object",
        "required": ["ships", "summary"],
        "additionalProperties": false,
        "properties": {
          "component": { "type": "string", "description": "The engine component the shape rides on (absent for shapes that are not component calls at all — a directory URL is one)." },
          "props": {
            "type": "object",
            "description": "The literal attributes a corpus writes to select the shape. Expression props are dropped silently by the interpreter — every documented call must stay literal.",
            "additionalProperties": { "type": "string" }
          },
          "ships": { "type": "boolean", "description": "Whether the shape renders today; a not-yet-shipping entry documents what lands with which item." },
          "summary": { "type": "string" }
        }
      }
    }
  }
}
