{
  "$schema": "./viewer-manifest.schema.json",
  "schemaVersion": 1,
  "viewer": {
    "name": "@immediately-run/grove",
    "kind": "wiki",
    "task": "open-wiki"
  },
  "components": {
    "a": {
      "tier": "engine",
      "overridable": true,
      "sanitizing": false,
      "props": {
        "href": "string?",
        "children": "node?"
      },
      "summary": "Wiki-link resolver: renders the resolved / broken / self states for an in-corpus href."
    },
    "img": {
      "tier": "engine",
      "overridable": true,
      "sanitizing": false,
      "props": {
        "src": "string?",
        "alt": "string?"
      },
      "summary": "Resolves a mount-relative asset off the filesystem."
    },
    "Callout": {
      "tier": "engine",
      "overridable": true,
      "sanitizing": false,
      "props": {
        "kind": "string?",
        "title": "string?",
        "children": "node?"
      },
      "summary": "An aside block with a kind (note / warning / …)."
    },
    "Lede": {
      "tier": "engine",
      "overridable": true,
      "sanitizing": false,
      "props": {
        "children": "node?"
      },
      "summary": "The opening paragraph, set apart typographically."
    },
    "Infobox": {
      "tier": "engine",
      "overridable": true,
      "sanitizing": false,
      "props": {
        "title": "string?",
        "children": "node?"
      },
      "summary": "The boxed summary panel a wiki entry carries beside its lede."
    },
    "More": {
      "tier": "engine",
      "overridable": true,
      "sanitizing": false,
      "props": {
        "href": "string?",
        "children": "node?"
      },
      "summary": "A 'read more' pointer to a related entry."
    },
    "DocList": {
      "tier": "engine",
      "overridable": true,
      "sanitizing": false,
      "props": {
        "tag": "string?",
        "limit": "number?",
        "paginate": "'infinite'?",
        "batch": "number?"
      },
      "summary": "A queried list of entries — the generic index primitive. paginate=\"infinite\" windows it with a sentinel and a stated end (R3-314); the attribute must be a literal."
    },
    "TagCloud": {
      "tier": "engine",
      "overridable": true,
      "sanitizing": false,
      "props": {
        "limit": "number?"
      },
      "summary": "Every tag in the corpus, weighted by use."
    },
    "TagList": {
      "tier": "engine",
      "overridable": true,
      "sanitizing": false,
      "props": {
        "tags": "string[]?"
      },
      "summary": "The tags of one entry, as links to their indexes."
    },
    "Directory": {
      "tier": "engine",
      "overridable": true,
      "sanitizing": false,
      "props": {
        "path": "string?"
      },
      "summary": "The entries under one corpus directory."
    },
    "DirectoryList": {
      "tier": "engine",
      "overridable": true,
      "sanitizing": false,
      "props": {
        "path": "string?",
        "title": "string?",
        "columns": "string?",
        "sort": "string?",
        "hidden": "boolean?"
      },
      "summary": "A folder listing as a table, with metadata columns chosen by `columns` and narrowed to those the rows actually carry."
    },
    "Quote": {
      "tier": "engine",
      "overridable": true,
      "sanitizing": false,
      "props": {
        "cite": "string?",
        "children": "node?"
      },
      "summary": "A pull quote with an optional citation."
    },
    "KeyValue": {
      "tier": "engine",
      "overridable": true,
      "sanitizing": false,
      "props": {
        "children": "node?"
      },
      "summary": "A definition-list row for infobox-style facts."
    },
    "Kbd": {
      "tier": "engine",
      "overridable": true,
      "sanitizing": false,
      "props": {
        "children": "node?"
      },
      "summary": "A keyboard key."
    },
    "Toc": {
      "tier": "engine",
      "overridable": true,
      "sanitizing": false,
      "props": {
        "depth": "number?"
      },
      "summary": "The table of contents derived from the entry's heading anchors."
    },
    "TableOfContents": {
      "tier": "engine",
      "overridable": true,
      "sanitizing": false,
      "props": {
        "entryKey": "string?",
        "title": "string?",
        "className": "string?"
      },
      "summary": "The on-this-page heading list, which keeps the active entry in view as the reader scrolls."
    },
    "Backlinks": {
      "tier": "engine",
      "overridable": true,
      "sanitizing": false,
      "props": {},
      "summary": "Entries linking to this one."
    },
    "PageMeta": {
      "tier": "engine",
      "overridable": true,
      "sanitizing": false,
      "props": {},
      "summary": "The entry's own metadata line (updated, reading time, …)."
    },
    "RecentlyUpdated": {
      "tier": "engine",
      "overridable": true,
      "sanitizing": false,
      "props": {
        "limit": "number?"
      },
      "summary": "The most recently updated entries."
    },
    "DocsByTag": {
      "tier": "engine",
      "overridable": true,
      "sanitizing": false,
      "props": {
        "tag": "string?"
      },
      "summary": "Entries grouped under one tag."
    },
    "ChildPages": {
      "tier": "engine",
      "overridable": true,
      "sanitizing": false,
      "props": {},
      "summary": "The entries nested under this one."
    },
    "Timeline": {
      "tier": "engine",
      "overridable": true,
      "sanitizing": false,
      "props": {
        "children": "node?"
      },
      "summary": "A dated sequence of entries or events."
    },
    "FamilyTree": {
      "tier": "engine",
      "overridable": true,
      "sanitizing": false,
      "props": {
        "children": "node?"
      },
      "summary": "A relationship graph rendered from frontmatter links."
    },
    "Outlet": {
      "tier": "engine",
      "overridable": false,
      "sanitizing": false,
      "props": {},
      "summary": "The layout chain's inward slot. NOT overridable — the chain's nesting is engine mechanics, and replacing it detaches every layer from the page it wraps."
    },
    "GroveNav": {
      "tier": "chrome",
      "overridable": true,
      "sanitizing": false,
      "props": {},
      "summary": "Top/side navigation. Reads the shell context, so an override must too (or render its own)."
    },
    "GroveSidebar": {
      "tier": "chrome",
      "overridable": true,
      "sanitizing": false,
      "props": {},
      "summary": "The corpus tree sidebar."
    },
    "GroveFooter": {
      "tier": "chrome",
      "overridable": true,
      "sanitizing": false,
      "props": {},
      "summary": "The site footer."
    },
    "ThemeGallery": {
      "tier": "engine",
      "overridable": true,
      "sanitizing": false,
      "props": {},
      "summary": "The themes gallery: one row per shipped theme, enumerated from this manifest — adding a theme adds a row with no edit to the entry."
    },
    "LayoutGallery": {
      "tier": "engine",
      "overridable": true,
      "sanitizing": false,
      "props": {},
      "summary": "The layouts gallery: the starters, page variants and collection shapes grouped by their three mechanisms, enumerated from this manifest."
    }
  },
  "frontmatter": {
    "engine": [
      "site",
      "theme",
      "stylesheets",
      "layout",
      "view",
      "frame",
      "render",
      "nav",
      "order",
      "tags",
      "cover"
    ],
    "passThrough": true
  },
  "themes": {
    "default": {
      "label": "immediately.run",
      "preferred": "dark",
      "ships": true,
      "summary": "The brand applied to a reading surface — the baseline every other look is measured against."
    },
    "archive": {
      "label": "Archive",
      "preferred": "light",
      "ships": true,
      "summary": "Encyclopedic reference: dense, quiet, contents-forward. Source Serif 4 reading face."
    },
    "journal": {
      "label": "Journal",
      "preferred": "light",
      "ships": true,
      "summary": "A personal notebook or family record: warm, short measure, soft frame. Lora reading face."
    },
    "editorial": {
      "label": "Editorial",
      "preferred": "dark",
      "ships": true,
      "summary": "Loud on purpose — a zine, a gig listing, a release archive. Loud through weight and colour, not a new face."
    }
  },
  "pageVariants": {
    "doc": {
      "key": "layout",
      "value": "doc",
      "ships": true,
      "summary": "The default reference page: contents rail, floated infobox, backlink index."
    },
    "post": {
      "key": "layout",
      "value": "post",
      "ships": true,
      "summary": "One measured column, no rails — the long-form entry."
    },
    "full": {
      "key": "layout",
      "value": "full",
      "ships": true,
      "summary": "The widest measure; drawn on the directory board rather than its own."
    },
    "bare": {
      "key": "frame",
      "value": "none",
      "ships": true,
      "summary": "No chrome at all; the entry supplies its own."
    }
  },
  "layouts": {
    "shell": {
      "layoutRole": "root",
      "arranges": "nav · sidebar · content · footer",
      "ships": true,
      "summary": "The site shell as copyable content. `nav: side` by default; flip the frontmatter to `nav: top` and drop the `<GroveSidebar/>` line for the top-nav arrangement."
    },
    "section": {
      "layoutRole": "section",
      "arranges": "shared hero + <Outlet/> + siblings rail",
      "ships": true,
      "summary": "A folder frame: one shared header above every entry in a subtree, `<ChildPages/>` below. Nest it under a root shell."
    },
    "hero": {
      "layoutRole": "root",
      "arranges": "a full-bleed image band over top navigation, then a short grid",
      "ships": true,